"GunosynewsItem","8","お店","ミハラヤスヒロ「MYne」がフルアイテムをそろえる唯一の旗艦店を原宿にオープン","https://gunosy.com/articles/aldov"
"GunosynewsItem","8","新製品","まさに一期一会！限定1500個だけの「いちご」を感じる焼き菓子！","https://gunosy.com/articles/amHdY"
"GunosynewsItem","8","新製品","コメダに初夏の新作スイーツ「瀬戸内レモンケーキ」--レモン風味&シャリシャリ食感がさわやか！","https://gunosy.com/articles/aZXXv"
"GunosynewsItem","8","新製品","最強コラボ！焼きたてチーズタルト「PABLO」の「パイの実」と「チョコパイ」","https://gunosy.com/articles/aDHxa"
"GunosynewsItem","8","レシピ","余ったジャガイモをどうにかする【超手軽ポテチもどき】","https://gunosy.com/articles/RQNjJ"
"GunosynewsItem","8","新製品","花々の香りで幸せ気分！ロクシタンのオーキデシリーズ","https://gunosy.com/articles/a7F4Z"
"GunosynewsItem","8","新製品","【あなたの予想は!?】マクドナルドが歴代No.1「マックフルーリー」を復刻！","https://gunosy.com/articles/RSNCi"
"GunosynewsItem","8","レシピ","旬野菜でひと品プラス！5分で作るかぶの副菜","https://gunosy.com/articles/Rv0Mc"
