"GunosynewsItem","1","芸能","菊地亜美が渡部建・佐々木希夫妻を祝福","https://gunosy.com/articles/R5q6D"
"GunosynewsItem","1","芸能","劇団EXILE鈴木伸之、初の父親役 東出昌大の双子で役作り？「だっこの練習していいよって」","https://gunosy.com/articles/R1h5d"
"GunosynewsItem","1","テレビ","「沢尻エリカらしくない」明石家さんまのイジりに“エリカ様”本領発揮？","https://gunosy.com/articles/atGjS"
"GunosynewsItem","1","テレビ","波瑠、不倫する役に戸惑うも「恋をしている感覚を大事に演じる」","https://gunosy.com/articles/aEp5L"
"GunosynewsItem","1","映画","山寺宏一、クリス・プラットとの初対面で緊張 「『俺の声をこんな眼鏡のおっさんが演じてる』と怒られたら...」","https://gunosy.com/articles/RTBVP"
"GunosynewsItem","1","テレビ","浅田真央の“引退発表の日”に密着 緊急生特番 フジで4・12放送","https://gunosy.com/articles/RuOhZ"
"GunosynewsItem","1","ゲーム","「ドラゴンクエストXI」Switch版は同時発売せず","https://gunosy.com/articles/alysu"
"GunosynewsItem","1","音楽","清水翔太、ミセス大森、SKY-HI、リトグリら参加 ACCESS!キャンペーン曲MV公開","https://gunosy.com/articles/aHEbZ"
"GunosynewsItem","1","音楽","SCLL、8年ぶり東名阪ツアーにtofubeats、シャムキャッツ、D.A.N.参加","https://gunosy.com/articles/RA0Xu"
"GunosynewsItem","1","音楽","elfin'、2ndシングルはRyu*×164の新曲","https://gunosy.com/articles/RKesv"
"GunosynewsItem","1","音楽","「アカギと鷲巣、どっちを救う!?」献血イベントが25周年展に合わせて開催","https://gunosy.com/articles/aGxi2"
"GunosynewsItem","1","芸能","吉本興業「ダンス・アカデミー」 校長トニー賞歌手","https://gunosy.com/articles/aXSEu"
"GunosynewsItem","1","テレビ","浅田真央の引退発表を受けてテレ朝が緊急生特番を放送","https://gunosy.com/articles/aEvgi"
"GunosynewsItem","1","ゲーム","「ドラクエXI」7月29日に発売 早期購入特典も発表","https://gunosy.com/articles/RwVvY"
"GunosynewsItem","1","テレビ","友近、仕事テーマの新番組でMC「吉本興業の人事担当に興味ある私にぴったり」","https://gunosy.com/articles/acgna"
"GunosynewsItem","1","漫画","足立区のイメージアップ狙う「出没！アダチック天国」ライオリで3カ月連続掲載","https://gunosy.com/articles/RXjJY"
"GunosynewsItem","1","ゲーム","【激報】ドラクエ11発売日決定！『過ぎ去りし時を求めて』は2017年7月29日に発売開始!! 予告動画も公開","https://gunosy.com/articles/Rimpu"
"GunosynewsItem","1","芸能","吉本興業設立のヒントン・バトルダンスアカデミー開校セレモニー","https://gunosy.com/articles/RfaZG"
"GunosynewsItem","1","芸能","【グゥーー！】激太りしたエドはるみがRIZAPで18キロ痩せたと話題に！！","https://gunosy.com/articles/a7KGG"
"GunosynewsItem","1","ゲーム","【アニマルアイドル育成ゲーム】ボルテージの「アニドルカラーズ」11キャラの声優陣とサンプルボイスを公開！","https://gunosy.com/articles/RPhtD"
"GunosynewsItem","2","格闘技","吉田沙保里が太鼓判！真央は「国民栄養賞に値するほど頑張った」","https://gunosy.com/articles/atbDG"
"GunosynewsItem","2","フィギュアスケート","浅田真央引退会見 NHK総合で生中継 約30分の枠を編成","https://gunosy.com/articles/aOoHd"
"GunosynewsItem","2","フィギュアスケート","「国民栄誉賞に値する」 吉田が引退表明の真央をねぎらう／レスリング","https://gunosy.com/articles/abtfu"
"GunosynewsItem","2","プロ野球","中崎の代わりにヘーゲンズが一軍へ！ 11日のプロ野球公示","https://gunosy.com/articles/RhLId"
"GunosynewsItem","2","プロ野球","がん闘病中の大島康徳氏が浅田真央をねぎらう","https://gunosy.com/articles/auYYY"
"GunosynewsItem","2","フィギュアスケート","【愛されている】浅田真央さんの現役引退に世界中から労いの言葉が届けられています","https://gunosy.com/articles/RpTOP"
"GunosynewsItem","2","サッカー日本代表","アメリカ・メキシコ・カナダ、3か国共催でW杯開催地立候補へ","https://gunosy.com/articles/aReyc"
"GunosynewsItem","2","フィギュアスケート","フジが12日夜に浅田真央の引退特番 秘蔵映像満載","https://gunosy.com/articles/aPZGY"
"GunosynewsItem","2","プロ野球","11日の公示 ソフトBが和田を抹消 ハムはマーティン抹消、ドラ4森山登録","https://gunosy.com/articles/R3cVu"
"GunosynewsItem","2","格闘技","吉田沙保里が太鼓判！真央は「国民栄養賞に値するほど頑張った」","https://gunosy.com/articles/aWrQS"
"GunosynewsItem","2","MLB","米大リーグ試合結果(10日)","https://gunosy.com/articles/RZqZ2"
"GunosynewsItem","2","Jリーグ","DAZNがJ1第6節のベスト5セーブを発表...広島を今季初勝利に導いた林など","https://gunosy.com/articles/RrmjJ"
"GunosynewsItem","2","Jリーグ","DAZNがJ1第6節のベスト5ゴールを発表...7得点の浦和から2名選出","https://gunosy.com/articles/aaIS2"
"GunosynewsItem","2","Jリーグ","DAZNがJ2第7節のベスト5ゴールを発表...ハットトリックの町田FW中島など","https://gunosy.com/articles/am4CD"
"GunosynewsItem","2","プロ野球","パドレス・マイヤーズがサイクル安打達成 今季メジャー初 球団2人目の偉業","https://gunosy.com/articles/R3AEP"
"GunosynewsItem","2","海外サッカー","ドルトのヤングスター、移籍の決め手は「監督の存在」。39試合に出場し23点に絡む活躍","https://gunosy.com/articles/aXhlc"
"GunosynewsItem","2","格闘技","プロレス界の名伯楽ラリー・シャープさん死去 バンバン・ビガロら育成","https://gunosy.com/articles/a6wc2"
"GunosynewsItem","2","フィギュアスケート","長友も真央にエール「これからの人生を応援したい」","https://gunosy.com/articles/RZcGY"
"GunosynewsItem","2","海外サッカー","解任されたラニエリ氏がレスター快進撃を称賛 「私が教えたことを実践し、とても幸せ」","https://gunosy.com/articles/aOZa2"
"GunosynewsItem","2","プロ野球","楽天-西武が中止 楽天梨田監督は恵みの雨と捉える","https://gunosy.com/articles/RiuFc"
"GunosynewsItem","3","ネタ","みんなのアイドル千代丸たん、ほっぺやあごを寄ってたかってムギュムギュつかまれるの巻","https://gunosy.com/articles/RKZxP"
"GunosynewsItem","3","猫","【球界ここだけの話(872)】開幕スタメンを勝ち取った西武・田代は根っからの生き物好き 小さな“家族”のためバットを振る","https://gunosy.com/articles/aFW7S"
"GunosynewsItem","3","動物","ボロボロの状態で保護された野良猫、実は美しいオッドアイの白猫だった","https://gunosy.com/articles/RomfP"
"GunosynewsItem","3","ネタ","【才能の無駄遣い】某ホテルのシャワーが「パリピ」過ぎると話題！更に音楽職人が仕上げる。","https://gunosy.com/articles/RbcnP"
"GunosynewsItem","3","動物","可愛いキャラで人気の脱出ゲームアプリ『ミスター3939の休暇』が壮大なストーリーで登場！","https://gunosy.com/articles/aO4QZ"
"GunosynewsItem","3","猫","【岩合光昭】子猫の“お別れのペロペロ”に胸キュン！","https://gunosy.com/articles/RSScG"
"GunosynewsItem","3","猫","まるでおとぎ話のような世界！ 不思議な存在感を放つスタンダードプードルのいる生活11枚(* ́ェ`*)","https://gunosy.com/articles/ae4Mc"
"GunosynewsItem","3","ネタ","ああ、お米を炊いていれば... レジ袋からのメッセージに後悔","https://gunosy.com/articles/a0hEP"
"GunosynewsItem","3","猫","ずぶ濡れネコ、身動きとれず 救出の“一部始終”","https://gunosy.com/articles/RLasa"
"GunosynewsItem","3","動物","切ない、、飼い主が亡くなった後も、毎日同じ道を散歩し続ける秋田犬","https://gunosy.com/articles/Rz5eu"
"GunosynewsItem","3","ネタ","もしかして共食い......？ イカがイカを捕える瞬間が南極海で撮影される 体当たりしながら触手でがっちりホールド","https://gunosy.com/articles/aOTCL"
"GunosynewsItem","3","動物","パンダの“理由ある抵抗” もう小屋には帰らない？","https://gunosy.com/articles/RSwgD"
"GunosynewsItem","3","ネタ","起こりうる悲劇！ジェットコースターに乗っていたら顔に鳥が直撃","https://gunosy.com/articles/RMdlS"
"GunosynewsItem","3","ネタ","【もふもふ柴ファミリー♡】あっち見てもこっち見ても柴があふれるお庭が...パラダイスだった(∩ ́∀`)∩","https://gunosy.com/articles/R57ea"
"GunosynewsItem","3","動物","話題のパズル】この中に隠れる「9匹の動物」を探すパズルが激ムズすぎるぞ！","https://gunosy.com/articles/RKIFJ"
"GunosynewsItem","3","ネタ","パパのウクレレ演奏中だけ泣き止み、演奏が止まると泣き出す赤ちゃん","https://gunosy.com/articles/RBexu"
"GunosynewsItem","3","ネタ","かわうそちわわ。(その91)","https://gunosy.com/articles/Rvtbc"
"GunosynewsItem","3","ネタ","排水用のパイプに落ちてしまった子ギツネ。懸命な救出活動の結果、無事に母キツネのもとに...。","https://gunosy.com/articles/RbjmP"
"GunosynewsItem","3","ネタ","ホットカーペットの恩恵を全身に受けるニャンコ","https://gunosy.com/articles/RoWqd"
"GunosynewsItem","3","ネタ","これどんな天変地異？オーストラリアで観測された雲を突き抜ける紫色の稲妻","https://gunosy.com/articles/RA8IL"
"GunosynewsItem","4","社会","石原氏らへの返還請求却下=新銀行東京設立で-都監査委員","https://gunosy.com/articles/a4WLY"
"GunosynewsItem","4","社会","中国道、阪和道、第二神明道路...渋滞を避けるには？ 2017年GW、関西地方の道路混雑予測","https://gunosy.com/articles/RCNKv"
"GunosynewsItem","4","経済","事業目標に必要な人材が確保できている企業は4割弱、アジアで最も人材不足が深刻な日本","https://gunosy.com/articles/RuZRJ"
"GunosynewsItem","4","経済","野村総合研究所、マイナンバーを活用した本人確認サービス「e-NINSHO」","https://gunosy.com/articles/aPzHL"
"GunosynewsItem","4","経済","Dell、2万円割引と購入金額の3%分のビットコインがもらえるキャンペーン","https://gunosy.com/articles/RdG4c"
"GunosynewsItem","4","経済","フードディスカバリー---メディアフラッグと共同でサービス診断士協会を設立","https://gunosy.com/articles/RJlSY"
"GunosynewsItem","4","経済","コンビニのポプラ、今期も営業赤字見通し","https://gunosy.com/articles/aDLfv"
"GunosynewsItem","4","社会","必要な備品を持ち込み認可後撤去、西東京市の保育園","https://gunosy.com/articles/aCqvG"
"GunosynewsItem","4","社会","リンさん通った小学校で入学式、千葉・我孫子","https://gunosy.com/articles/a7Esv"
"GunosynewsItem","4","社会","関東〜四国にかけて太平洋側で大荒れ  帰宅時の交通に影響も？","https://gunosy.com/articles/RyzOu"
"GunosynewsItem","4","経済","東芝のメモリ事業入札競争、TSMCが離脱を決意か―背景には日本政府？","https://gunosy.com/articles/Rqz8L"
"GunosynewsItem","4","経済","登山初心者におすすめ！プロの山岳ガイドが丁寧に答えてくれるチャット形式のQ&Aサービス『Sherpa』","https://gunosy.com/articles/Rby0c"
"GunosynewsItem","4","経済","ポテチ価格、フリマで一袋500円 販売休止で一気にプレミア化","https://gunosy.com/articles/RWa5i"
"GunosynewsItem","4","経済","片山正通の膨大なコレクション、書籍、CD、骨董、家具...が一堂に。「片山正通的百科全書」が開催中","https://gunosy.com/articles/RT5jZ"
"GunosynewsItem","4","経済","東芝に見る「海外進出における企業統治」の教訓","https://gunosy.com/articles/RfA1i"
"GunosynewsItem","4","社会","鎌倉花火大会が中止へ 市の名物行事がなぜ？","https://gunosy.com/articles/abpMJ"
"GunosynewsItem","4","社会","11日14時56分頃 - 最大震度 1 - 震源地 熊本県熊本地方","https://gunosy.com/articles/atWgD"
"GunosynewsItem","4","政治","【長島昭久氏民進離党】民進・大串博志政調会長「一体、今頃何を言っているんだ」 不快感示す","https://gunosy.com/articles/RYFDG"
"GunosynewsItem","4","経済","アミューズメント機器製造のKHP、特別清算開始...創業時はオート三輪ホープスターを開発","https://gunosy.com/articles/RmVqD"
"GunosynewsItem","4","社会","サッポロビール「酒税115億円返還」国を提訴へ","https://gunosy.com/articles/RszID"
"GunosynewsItem","5","中国・韓国・アジア","日本で当たり前のように見る建物の屋上駐車場、中国では珍しい・・・なぜ？ =中国メディア","https://gunosy.com/articles/aCTHi"
"GunosynewsItem","5","国外総合","ウィークリーレポート：地政学リスクとともにイギリス、オーストラリア経済も注視！住信SBIネット銀行(三井智映子)","https://gunosy.com/articles/RL8jZ"
"GunosynewsItem","5","国外総合","乗客「引きずり降ろし」に批判、米ユナイテッド航空","https://gunosy.com/articles/Rj2v2"
"GunosynewsItem","5","国外総合","乗客血まみれにして引きずり降ろす ユナイテッド航空「強制降機」動画が大炎上","https://gunosy.com/articles/RdQmP"
"GunosynewsItem","5","国外総合","南スーダン第2の都市で戦闘、民間人16人死亡 国連","https://gunosy.com/articles/aPO3i"
"GunosynewsItem","5","中国・韓国・アジア","韓国の旅客船、済州島近海にふん尿2トンをこっそり捨てる=韓国ネット「この国はどうかしてる」「国民がノロウイルスで苦しむわけだ」","https://gunosy.com/articles/aOFMc"
"GunosynewsItem","5","国外総合","カテゴリー3の熱帯サイクロン 南太平洋のバヌアツに直撃","https://gunosy.com/articles/aLovY"
"GunosynewsItem","5","中国・韓国・アジア","明日の日本株の読み筋=上値の重い展開か、地政学リスクくすぶる","https://gunosy.com/articles/aZlEP"
"GunosynewsItem","5","中国・韓国・アジア","日本人のイメージは「偏見」だった！ 実際の日本人は「友好的だった」=中国報道","https://gunosy.com/articles/RMwqd"
"GunosynewsItem","5","中国・韓国・アジア","「中国に好感」、ロシア人の8割近くが回答―露メディア","https://gunosy.com/articles/aaOaY"
"GunosynewsItem","5","国外総合","トランプ氏のファミリー企業、モデル事務所を閉鎖へ","https://gunosy.com/articles/RMG6i"
"GunosynewsItem","5","中国・韓国・アジア","【北朝鮮情勢】米、中国企業の制裁強化を日本に伝達 北の核兵器開発への関与めぐり","https://gunosy.com/articles/R2r4S"
"GunosynewsItem","5","国外総合","モスルに置き去りにされたライオンとクマ、治療のためヨルダンへ","https://gunosy.com/articles/R8CIL"
"GunosynewsItem","5","中国・韓国・アジア","詐欺被害の中国高齢者、驚きの理由から通報を拒否―中国メディア","https://gunosy.com/articles/RZXqD"
"GunosynewsItem","5","国外総合","隠しカメラや盗聴器で選手監視、ギリシャサッカー連盟で不正発覚","https://gunosy.com/articles/RBTrv"
"GunosynewsItem","5","中国・韓国・アジア","サラダパックにコウモリの死骸、狂犬病の可能性調査 米","https://gunosy.com/articles/RfDbJ"
"GunosynewsItem","5","国外総合","席足りず、乗客引きずり降ろす...航空会社“塩対応”","https://gunosy.com/articles/aLSov"
"GunosynewsItem","5","中国・韓国・アジア","韓国の英雄が眠る国立墓地に花見客が大挙、酒盛りにごろ寝で厳かな雰囲気もぶち壊し=「日本人は靖国神社でこんなまねはしない」―韓国ネット","https://gunosy.com/articles/aGc8D"
"GunosynewsItem","5","国外総合","【ビデオ】マツダ「ロードスター」にV8エンジンを搭載しようとしたら大変なことに！","https://gunosy.com/articles/aqHtL"
"GunosynewsItem","5","国外総合","ユナイテッド航空、オーバーブックのためアジア人男性医師を無理やり引きずりおろす SNS上でボイコットも","https://gunosy.com/articles/RQdcG"
"GunosynewsItem","6","コラム総合","「家を買うと転勤になる」と思う?","https://gunosy.com/articles/R0gyS"
"GunosynewsItem","6","コラム総合","大阪人が教えたる。大阪の雨の日におすすめの観光スポット特集","https://gunosy.com/articles/RfEwL"
"GunosynewsItem","6","コラム総合","【歴史的偉業】67歳おじいちゃんが数学上の未解決問題を“歯磨き中”に解決！ 徹底解説「ガウスの相関予想(GCC)」","https://gunosy.com/articles/R18J2"
"GunosynewsItem","6","コラム総合","【シャドウバース】ウロボロスが2枚出たし、ドラゴンデッキを初めて構築したら意外と強かった","https://gunosy.com/articles/aELJG"
"GunosynewsItem","6","ビューティー","洗練フェイスは、眉が決める！ 『SUQQU』の新作コスメでつくる立体美眉☆","https://gunosy.com/articles/R2E1D"
"GunosynewsItem","6","ビューティー","【マジョリカマジョルカ】イエロー&グリーンで脱マンネリ！単色シャドウで作るオシャ見え“セレブ顔”","https://gunosy.com/articles/RZ2Ka"
"GunosynewsItem","6","コラム総合","このマナーを知っていれば、仕事がもっとうまくいく！","https://gunosy.com/articles/Rr2lS"
"GunosynewsItem","6","コラム総合","投資スタイルを3点見直せば「年収1500万」に近づく","https://gunosy.com/articles/RW0gd"
"GunosynewsItem","6","コラム総合","オービィ大阪 地球を丸ごと体感できる超人気スポットの魅力に迫る！","https://gunosy.com/articles/Ro6LY"
"GunosynewsItem","6","ファッション","2017トレンド！サッシュベルトの巻き方4style","https://gunosy.com/articles/R1Ssa"
"GunosynewsItem","6","ビューティー","「BOTANIST」シャンプーやボディソープに続きスクラブ登場","https://gunosy.com/articles/RFbhS"
"GunosynewsItem","6","コラム総合","英王室シャーロット王女のグッズや子供用コスメがまもなく販売へ","https://gunosy.com/articles/a0Xma"
"GunosynewsItem","6","コラム総合","教師になるには？ 教員免許・試験の仕組みをわかりやすく解説","https://gunosy.com/articles/RJb6d"
"GunosynewsItem","6","ビューティー","顔型の悩みもカバー。骨格矯正できる美人小顔No.1ヘアはコレ！","https://gunosy.com/articles/aWFAJ"
"GunosynewsItem","6","コラム総合","かわいいのポイントは写真の“盛り方”？ 「女子高生ミスコン」ファイナリストの平均顔が公開","https://gunosy.com/articles/RujCD"
"GunosynewsItem","6","コラム総合","女子中高生の政治意識 〇割が日本の将来が不安","https://gunosy.com/articles/auCS2"
"GunosynewsItem","6","コラム総合","西武渋谷で春服セール開催 「東京古着」限定ショップも初登場","https://gunosy.com/articles/R3qyS"
"GunosynewsItem","6","コラム総合","くぅ〜〜〜これは嬉しい！！もらってハッピーになれる誕生日プレゼント","https://gunosy.com/articles/R2EuY"
"GunosynewsItem","6","コラム総合","妊産婦で死亡例「オウム病」って何? - 症状と予防法","https://gunosy.com/articles/RFbWL"
"GunosynewsItem","6","ビューティー","メイクボックスの中身公開(o^^o)大容量で使いやすいー！！","https://gunosy.com/articles/a0XRZ"
"GunosynewsItem","7","IT総合","レゴ×IoTで、部分的に動作する「Macintosh Classic」をつくろう","https://gunosy.com/articles/Rs3tL"
"GunosynewsItem","7","アプリ","ワンタッチで助け呼べる中国初のアプリ登場―中国紙","https://gunosy.com/articles/R0McY"
"GunosynewsItem","7","IT総合","フランフラン、VRを活用した商品のコーディネートサービス開始","https://gunosy.com/articles/R5MLG"
"GunosynewsItem","7","IT総合","CiNii、電子化論文の公開を一部再開 学協会との調整が必要なものを除く約110万件が閲覧可能に","https://gunosy.com/articles/RBrYG"
"GunosynewsItem","7","IT総合","10m防水と音声コマンドに対応したGoProの最上位モデル『HERO5 Black』","https://gunosy.com/articles/RNKWd"
"GunosynewsItem","7","IT総合","専用ICで方式の異なるスマホ・タブレットを自動判別し最適充電 コンパクトなUSB急速充電器","https://gunosy.com/articles/RLpnu"
"GunosynewsItem","7","アプリ","ピアノや三味線、サックスなどの練習ができる無料アプリ「ON-KATSU@home」","https://gunosy.com/articles/R18zc"
"GunosynewsItem","7","IT総合","源ノ明朝には縦書き用の""かたち""がある - フォントデザイナーが語る制作秘話","https://gunosy.com/articles/a9FVP"
"GunosynewsItem","7","Apple","iPhone、米ティーン間の人気衰えず〜76%が使用、81%購入希望","https://gunosy.com/articles/aeJ3d"
"GunosynewsItem","7","IT総合","エレコム、複数の機器で高速通信が可能な「MU-MIMO」対応11ac無線LANルータ","https://gunosy.com/articles/RnsVa"
"GunosynewsItem","7","IT総合","ルネサス、自動運転時代に向けた新コンセプト「Renesas autonomy」を発表","https://gunosy.com/articles/acXD2"
"GunosynewsItem","7","Apple","MacBookシリーズ、米誌ランキングで首位から5位に転落！拡張性や価格が低評価","https://gunosy.com/articles/aLhAJ"
"GunosynewsItem","7","IT総合","LINE、脆弱性を見つけた人に報奨金を支払うプログラムを拡充","https://gunosy.com/articles/aP0xv"
"GunosynewsItem","7","IT総合","AMD、無線VR／ARチップのNitero買収","https://gunosy.com/articles/R5VQS"
"GunosynewsItem","7","サイエンス","火星の過酷環境でも育つ“スーパーポテト”が発見される！ 理学博士が衝撃暴露「NASAの狙いは火星移住ではなく...」","https://gunosy.com/articles/RVuKa"
"GunosynewsItem","7","IT総合","【やっぱあった】ニンテンドースイッチで「ブラウザ」を起動する方法が発見される！しかし重い。","https://gunosy.com/articles/az9J2"
"GunosynewsItem","7","IT総合","窓辺とおこの3Dデータなど、DSP版Windows 10購入者向けのキャンペーン","https://gunosy.com/articles/RBtXP"
"GunosynewsItem","7","IT総合","無料で任天堂のロゴ風デザインが作れるフォント「Nu Hanafudaya」","https://gunosy.com/articles/aav6i"
"GunosynewsItem","7","IT総合","ブラジルで医療費支払いカード・サービスを開始=メドシス〔BW〕","https://gunosy.com/articles/RJ9LY"
"GunosynewsItem","7","IT総合","週刊アスキー No.1122 (2017年4月11日発行)","https://gunosy.com/articles/R8wxa"
"GunosynewsItem","8","グルメ総合","パン好きが多い都道府県ランキングTOP3","https://gunosy.com/articles/RB6Ev"
"GunosynewsItem","8","お店","日本初の「肉骨茶(バクテー)」専門店","https://gunosy.com/articles/aFnWd"
"GunosynewsItem","8","新製品","ピンクが可愛い♪ローソンに「まるでいちご蒸しケーキ」--ふんわり蒸しパンでホイップをサンド","https://gunosy.com/articles/agmCi"
"GunosynewsItem","8","新製品","3つを一口で！ ハーゲンダッツ新作はコク×甘酸っぱさ×タルトの絶妙バランス","https://gunosy.com/articles/aO1xa"
"GunosynewsItem","8","グルメ総合","【公式の本気】パン「いっけなーい！ 新学期そうそう遅刻遅刻！」→あぶないっ！ ドン！→生まれたのは恋...じゃなくてあんバタートースト","https://gunosy.com/articles/aP1Z2"
"GunosynewsItem","8","新製品","55周年記念第2弾は「こだわり和糖のカスタードプリン」！","https://gunosy.com/articles/aq80Z"
"GunosynewsItem","8","グルメ総合","東京駅に新しいお土産が登場！焼きたてが食べられる「プレスバターサンド」が気になる♪","https://gunosy.com/articles/RIxhZ"
"GunosynewsItem","8","新製品","ティータイムはもちろんアペにも！ SPURおやつ部がおすすめする、ドライフルーツを使ったスイーツ","https://gunosy.com/articles/ag4HL"
"GunosynewsItem","8","新製品","米で進む炭酸飲料離れ 新たなトレンド「クラフト飲料」とは","https://gunosy.com/articles/RPKwL"
"GunosynewsItem","8","新製品","「ロクシタン」から幸せが舞いこむような香り！「オーキデ」シリーズが新登場","https://gunosy.com/articles/RClrP"
"GunosynewsItem","8","新製品","数量限定1,500個!--「からめる焼 都いちご」は、サクサクのラスク","https://gunosy.com/articles/RJwNu"
"GunosynewsItem","8","新製品","イッセイ ミヤケ パルファムから青い海原へ誘う、二つの夏の香りが到着","https://gunosy.com/articles/axMHL"
